{"$schema": "http://json-schema.org/draft-04/hyper-schema#", "type": "object", "properties": {"name": {"type": ["string", "null"], "maxLength": 60}, "$uri": {"pattern": "^\\/api\\/v1\\/jobs\\/[^/]+$", "readOnly": true, "type": "string"}, "created_at": {"readOnly": true, "type": "string", "format": "date-time"}, "current": {"default": true, "type": ["boolean", "null"]}, "analysis_type": {"type": ["string", "null"], "maxLength": 50}, "public": {"default": false, "type": ["boolean", "null"]}}, "links": [{"href": "/api/v1/jobs/schema", "method": "GET", "rel": "describedBy"}, {"targetSchema": {"items": {"$ref": "#"}, "type": "array"}, "href": "/api/v1/jobs", "method": "GET", "rel": "instances", "schema": {"additionalProperties": true, "type": "object", "properties": {"sort": {"additionalProperties": false, "type": "object", "properties": {"name": {"type": "boolean", "description": "Sort by name in descending order if 'true', ascending order if 'false'."}, "$uri": {"type": "boolean", "description": "Sort by $uri in descending order if 'true', ascending order if 'false'."}, "created_at": {"type": "boolean", "description": "Sort by created_at in descending order if 'true', ascending order if 'false'."}, "current": {"type": "boolean", "description": "Sort by current in descending order if 'true', ascending order if 'false'."}, "analysis_type": {"type": "boolean", "description": "Sort by analysis_type in descending order if 'true', ascending order if 'false'."}, "public": {"type": "boolean", "description": "Sort by public in descending order if 'true', ascending order if 'false'."}}}, "per_page": {"default": 20, "minimum": 1, "type": "integer", "maximum": 1000}, "where": {"additionalProperties": false, "type": "object", "properties": {"name": {"anyOf": [{"additionalProperties": false, "required": ["$startswith"], "type": "object", "properties": {"$startswith": {"minLength": 1, "type": "string"}}}, {"type": ["string", "null"], "maxLength": 60}, {"additionalProperties": false, "required": ["$contains"], "type": "object", "properties": {"$contains": {"minLength": 1, "type": "string"}}}, {"additionalProperties": false, "required": ["$ne"], "type": "object", "properties": {"$ne": {"type": ["string", "null"], "maxLength": 60}}}, {"additionalProperties": false, "required": ["$iendswith"], "type": "object", "properties": {"$iendswith": {"minLength": 1, "type": "string"}}}, {"additionalProperties": false, "required": ["$icontains"], "type": "object", "properties": {"$icontains": {"minLength": 1, "type": "string"}}}, {"additionalProperties": false, "required": ["$endswith"], "type": "object", "properties": {"$endswith": {"minLength": 1, "type": "string"}}}, {"additionalProperties": false, "required": ["$istartswith"], "type": "object", "properties": {"$istartswith": {"minLength": 1, "type": "string"}}}, {"additionalProperties": false, "required": ["$in"], "type": "object", "properties": {"$in": {"minItems": 0, "items": {"type": ["string", "null"], "maxLength": 60}, "uniqueItems": true, "type": "array"}}}, {"additionalProperties": false, "required": ["$eq"], "type": "object", "properties": {"$eq": {"type": ["string", "null"], "maxLength": 60}}}]}, "$uri": {"anyOf": [{"additionalProperties": false, "required": ["$ne"], "type": "object", "properties": {"$ne": {"pattern": "^\\/api\\/v1\\/jobs\\/[^/]+$", "type": "string"}}}, {"additionalProperties": false, "required": ["$eq"], "type": "object", "properties": {"$eq": {"pattern": "^\\/api\\/v1\\/jobs\\/[^/]+$", "type": "string"}}}, {"pattern": "^\\/api\\/v1\\/jobs\\/[^/]+$", "type": "string"}, {"additionalProperties": false, "required": ["$in"], "type": "object", "properties": {"$in": {"minItems": 0, "items": {"pattern": "^\\/api\\/v1\\/jobs\\/[^/]+$", "type": "string"}, "uniqueItems": true, "type": "array"}}}]}, "created_at": {"anyOf": [{"additionalProperties": false, "required": ["$gt"], "type": "object", "properties": {"$gt": {"type": "string", "format": "date-time"}}}, {"type": "string", "format": "date-time"}, {"additionalProperties": false, "required": ["$ne"], "type": "object", "properties": {"$ne": {"type": "string", "format": "date-time"}}}, {"additionalProperties": false, "required": ["$lt"], "type": "object", "properties": {"$lt": {"type": "string", "format": "date-time"}}}, {"additionalProperties": false, "required": ["$lte"], "type": "object", "properties": {"$lte": {"type": "string", "format": "date-time"}}}, {"additionalProperties": false, "required": ["$between"], "type": "object", "properties": {"$between": {"minItems": 2, "items": {"type": "string", "format": "date-time"}, "type": "array", "maxItems": 2}}}, {"additionalProperties": false, "required": ["$eq"], "type": "object", "properties": {"$eq": {"type": "string", "format": "date-time"}}}, {"additionalProperties": false, "required": ["$gte"], "type": "object", "properties": {"$gte": {"type": "string", "format": "date-time"}}}]}, "current": {"anyOf": [{"additionalProperties": false, "required": ["$ne"], "type": "object", "properties": {"$ne": {"default": true, "type": ["boolean", "null"]}}}, {"additionalProperties": false, "required": ["$eq"], "type": "object", "properties": {"$eq": {"default": true, "type": ["boolean", "null"]}}}, {"default": true, "type": ["boolean", "null"]}, {"additionalProperties": false, "required": ["$in"], "type": "object", "properties": {"$in": {"minItems": 0, "items": {"default": true, "type": ["boolean", "null"]}, "uniqueItems": true, "type": "array"}}}]}, "analysis_type": {"anyOf": [{"additionalProperties": false, "required": ["$startswith"], "type": "object", "properties": {"$startswith": {"minLength": 1, "type": "string"}}}, {"type": ["string", "null"], "maxLength": 50}, {"additionalProperties": false, "required": ["$contains"], "type": "object", "properties": {"$contains": {"minLength": 1, "type": "string"}}}, {"additionalProperties": false, "required": ["$ne"], "type": "object", "properties": {"$ne": {"type": ["string", "null"], "maxLength": 50}}}, {"additionalProperties": false, "required": ["$iendswith"], "type": "object", "properties": {"$iendswith": {"minLength": 1, "type": "string"}}}, {"additionalProperties": false, "required": ["$icontains"], "type": "object", "properties": {"$icontains": {"minLength": 1, "type": "string"}}}, {"additionalProperties": false, "required": ["$endswith"], "type": "object", "properties": {"$endswith": {"minLength": 1, "type": "string"}}}, {"additionalProperties": false, "required": ["$istartswith"], "type": "object", "properties": {"$istartswith": {"minLength": 1, "type": "string"}}}, {"additionalProperties": false, "required": ["$in"], "type": "object", "properties": {"$in": {"minItems": 0, "items": {"type": ["string", "null"], "maxLength": 50}, "uniqueItems": true, "type": "array"}}}, {"additionalProperties": false, "required": ["$eq"], "type": "object", "properties": {"$eq": {"type": ["string", "null"], "maxLength": 50}}}]}, "public": {"anyOf": [{"additionalProperties": false, "required": ["$ne"], "type": "object", "properties": {"$ne": {"default": false, "type": ["boolean", "null"]}}}, {"additionalProperties": false, "required": ["$eq"], "type": "object", "properties": {"$eq": {"default": false, "type": ["boolean", "null"]}}}, {"default": false, "type": ["boolean", "null"]}, {"additionalProperties": false, "required": ["$in"], "type": "object", "properties": {"$in": {"minItems": 0, "items": {"default": false, "type": ["boolean", "null"]}, "uniqueItems": true, "type": "array"}}}]}}}, "page": {"default": 1, "minimum": 1, "type": "integer"}}}}, {"targetSchema": {"additionalProperties": false, "type": "object", "properties": {"$ref": {"pattern": "^\\/api\\/v1\\/analyses\\/[^/]+$", "type": "string"}}}, "href": "/api/v1/jobs/{id}/run", "method": "POST", "rel": "run", "schema": {"additionalProperties": false, "required": ["sample", "job_args"], "type": "object", "properties": {"sample": {"anyOf": [{"additionalProperties": false, "type": "object", "properties": {"$ref": {"pattern": "^\\/api\\/v1\\/samples\\/[^/]+$", "type": "string"}}}, {"type": ["string", "null"], "maxLength": 16}]}, "job_args": {"additionalProperties": {"type": ["null", "string", "number", "boolean", "object", "array"]}, "type": "object"}}}}, {"targetSchema": {"$ref": "#"}, "href": "/api/v1/jobs/{id}", "method": "GET", "rel": "self"}]}