[{"name": "Alignment Run", "$uri": "/api/v1/jobs/9359554ff4f34137", "created_at": "2015-09-14T13:20:15.528558-07:00", "current": false, "analysis_type": "alignment", "public": false}, {"name": "Alignment", "$uri": "/api/v1/jobs/fd5f5264781d477e", "created_at": "2016-07-12T16:42:46.234631-07:00", "current": true, "analysis_type": "alignment", "public": true}, {"name": "RefSeq Complete Genomes", "$uri": "/api/v1/jobs/52c73e0c9a4d4b3f", "created_at": "2015-11-01T16:28:03.974596-08:00", "current": true, "analysis_type": "classification", "public": true}, {"name": "ARD Panel v1", "$uri": "/api/v1/jobs/c4f763556452402c", "created_at": "2015-09-11T17:43:58.818569-07:00", "current": false, "analysis_type": "markerpanel", "public": false}, {"name": "One Codex (NNLS) (latest)", "$uri": "/api/v1/jobs/c3caae64b63b4f07", "created_at": "2016-04-07T14:47:36.054255-07:00", "current": true, "analysis_type": "classification", "public": false}, {"name": "One Codex 38K Database", "$uri": "/api/v1/jobs/1ede4125214542e0", "created_at": "2015-08-31T16:38:25.833478-07:00", "current": false, "analysis_type": "classification", "public": false}, {"name": "One Codex Database w/NNLS", "$uri": "/api/v1/jobs/b18ea5e828224e3c", "created_at": "2016-02-08T13:56:55.156056-08:00", "current": true, "analysis_type": "classification", "public": true}, {"name": "RefSeq Complete Genomes", "$uri": "/api/v1/jobs/e4b1ab37ff554c53", "created_at": "2015-09-01T10:11:15.493388-07:00", "current": true, "analysis_type": "classification", "public": true}, {"name": "Targeted Loci Database", "$uri": "/api/v1/jobs/7076363bfd204971", "created_at": "2016-05-01T17:28:52.104426-07:00", "current": true, "analysis_type": "classification", "public": true}, {"name": "One Codex S. enterica Typing", "$uri": "/api/v1/jobs/47c4fe23588640a9", "created_at": "2015-04-28T17:45:49-07:00", "current": false, "analysis_type": "typing", "public": false}, {"name": "One Codex Database w/NNLS", "$uri": "/api/v1/jobs/0d558feada6f47ac", "created_at": "2016-02-09T08:38:49.504357-08:00", "current": true, "analysis_type": "classification", "public": true}, {"name": "One Codex Database", "$uri": "/api/v1/jobs/d512cb556241440f", "created_at": "2015-11-01T16:27:19.140577-08:00", "current": true, "analysis_type": "classification", "public": true}]